{
  "data_file_offset": 477127,
  "data_label": "DictionaryEntries",
  "format": "zelda-suite-dictionary-inventory",
  "format_version": 1,
  "fragment_count": 98,
  "fragments": [
    {
      "data_directive": "db",
      "declared_payload_bytes": 4,
      "directive_value_count": 4,
      "directive_width_bytes": 1,
      "fragment_file_offset": 477127,
      "fragment_label": ".fourSpaces",
      "fragment_source_line": 6148,
      "is_end_of_table": false,
      "next_fragment_file_offset": 477131,
      "pointer_entry_file_offset": 476931,
      "pointer_expression": "DictionaryEntries_fourSpaces",
      "pointer_index": 0,
      "source_extent_bytes": 4,
      "source_extent_matches_directive": true,
      "source_revision": "347c23f9fc019c72d32da537c9cb235f468d021d"
    },
    {
      "data_directive": "db",
      "declared_payload_bytes": 3,
      "directive_value_count": 3,
      "directive_width_bytes": 1,
      "fragment_file_offset": 477131,
      "fragment_label": ".threeSpaces",
      "fragment_source_line": 6152,
      "is_end_of_table": false,
      "next_fragment_file_offset": 477134,
      "pointer_entry_file_offset": 476933,
      "pointer_expression": "DictionaryEntries_threeSpaces",
      "pointer_index": 1,
      "source_extent_bytes": 3,
      "source_extent_matches_directive": true,
      "source_revision": "347c23f9fc019c72d32da537c9cb235f468d021d"
    },
    {
      "data_directive": "db",
      "declared_payload_bytes": 2,
      "directive_value_count": 2,
      "directive_width_bytes": 1,
      "fragment_file_offset": 477134,
      "fragment_label": ".twoSpaces",
      "fragment_source_line": 6156,
      "is_end_of_table": false,
      "next_fragment_file_offset": 477136,
      "pointer_entry_file_offset": 476935,
      "pointer_expression": "DictionaryEntries_twoSpaces",
      "pointer_index": 2,
      "source_extent_bytes": 2,
      "source_extent_matches_directive": true,
      "source_revision": "347c23f9fc019c72d32da537c9cb235f468d021d"
    },
    {
      "data_directive": "db",
      "declared_payload_bytes": 3,
      "directive_value_count": 3,
      "directive_width_bytes": 1,
      "fragment_file_offset": 477136,
      "fragment_label": ".possessive",
      "fragment_source_line": 6160,
      "is_end_of_table": false,
      "next_fragment_file_offset": 477139,
      "pointer_entry_file_offset": 476937,
      "pointer_expression": "DictionaryEntries_possessive",
      "pointer_index": 3,
      "source_extent_bytes": 3,
      "source_extent_matches_directive": true,
      "source_revision": "347c23f9fc019c72d32da537c9cb235f468d021d"
    },
    {
      "data_directive": "db",
      "declared_payload_bytes": 4,
      "directive_value_count": 4,
      "directive_width_bytes": 1,
      "fragment_file_offset": 477139,
      "fragment_label": ".and_space",
      "fragment_source_line": 6164,
      "is_end_of_table": false,
      "next_fragment_file_offset": 477143,
      "pointer_entry_file_offset": 476939,
      "pointer_expression": "DictionaryEntries_and_space",
      "pointer_index": 4,
      "source_extent_bytes": 4,
      "source_extent_matches_directive": true,
      "source_revision": "347c23f9fc019c72d32da537c9cb235f468d021d"
    },
    {
      "data_directive": "db",
      "declared_payload_bytes": 4,
      "directive_value_count": 4,
      "directive_width_bytes": 1,
      "fragment_file_offset": 477143,
      "fragment_label": ".are_space",
      "fragment_source_line": 6168,
      "is_end_of_table": false,
      "next_fragment_file_offset": 477147,
      "pointer_entry_file_offset": 476941,
      "pointer_expression": "DictionaryEntries_are_space",
      "pointer_index": 5,
      "source_extent_bytes": 4,
      "source_extent_matches_directive": true,
      "source_revision": "347c23f9fc019c72d32da537c9cb235f468d021d"
    },
    {
      "data_directive": "db",
      "declared_payload_bytes": 4,
      "directive_value_count": 4,
      "directive_width_bytes": 1,
      "fragment_file_offset": 477147,
      "fragment_label": ".all_space",
      "fragment_source_line": 6172,
      "is_end_of_table": false,
      "next_fragment_file_offset": 477151,
      "pointer_entry_file_offset": 476943,
      "pointer_expression": "DictionaryEntries_all_space",
      "pointer_index": 6,
      "source_extent_bytes": 4,
      "source_extent_matches_directive": true,
      "source_revision": "347c23f9fc019c72d32da537c9cb235f468d021d"
    },
    {
      "data_directive": "db",
      "declared_payload_bytes": 3,
      "directive_value_count": 3,
      "directive_width_bytes": 1,
      "fragment_file_offset": 477151,
      "fragment_label": ".ain",
      "fragment_source_line": 6176,
      "is_end_of_table": false,
      "next_fragment_file_offset": 477154,
      "pointer_entry_file_offset": 476945,
      "pointer_expression": "DictionaryEntries_ain",
      "pointer_index": 7,
      "source_extent_bytes": 3,
      "source_extent_matches_directive": true,
      "source_revision": "347c23f9fc019c72d32da537c9cb235f468d021d"
    },
    {
      "data_directive": "db",
      "declared_payload_bytes": 3,
      "directive_value_count": 3,
      "directive_width_bytes": 1,
      "fragment_file_offset": 477154,
      "fragment_label": ".and_no_space",
      "fragment_source_line": 6180,
      "is_end_of_table": false,
      "next_fragment_file_offset": 477157,
      "pointer_entry_file_offset": 476947,
      "pointer_expression": "DictionaryEntries_and_no_space",
      "pointer_index": 8,
      "source_extent_bytes": 3,
      "source_extent_matches_directive": true,
      "source_revision": "347c23f9fc019c72d32da537c9cb235f468d021d"
    },
    {
      "data_directive": "db",
      "declared_payload_bytes": 3,
      "directive_value_count": 3,
      "directive_width_bytes": 1,
      "fragment_file_offset": 477157,
      "fragment_label": ".at_space",
      "fragment_source_line": 6184,
      "is_end_of_table": false,
      "next_fragment_file_offset": 477160,
      "pointer_entry_file_offset": 476949,
      "pointer_expression": "DictionaryEntries_at_space",
      "pointer_index": 9,
      "source_extent_bytes": 3,
      "source_extent_matches_directive": true,
      "source_revision": "347c23f9fc019c72d32da537c9cb235f468d021d"
    },
    {
      "data_directive": "db",
      "declared_payload_bytes": 3,
      "directive_value_count": 3,
      "directive_width_bytes": 1,
      "fragment_file_offset": 477160,
      "fragment_label": ".ast",
      "fragment_source_line": 6188,
      "is_end_of_table": false,
      "next_fragment_file_offset": 477163,
      "pointer_entry_file_offset": 476951,
      "pointer_expression": "DictionaryEntries_ast",
      "pointer_index": 10,
      "source_extent_bytes": 3,
      "source_extent_matches_directive": true,
      "source_revision": "347c23f9fc019c72d32da537c9cb235f468d021d"
    },
    {
      "data_directive": "db",
      "declared_payload_bytes": 2,
      "directive_value_count": 2,
      "directive_width_bytes": 1,
      "fragment_file_offset": 477163,
      "fragment_label": ".an",
      "fragment_source_line": 6192,
      "is_end_of_table": false,
      "next_fragment_file_offset": 477165,
      "pointer_entry_file_offset": 476953,
      "pointer_expression": "DictionaryEntries_an",
      "pointer_index": 11,
      "source_extent_bytes": 2,
      "source_extent_matches_directive": true,
      "source_revision": "347c23f9fc019c72d32da537c9cb235f468d021d"
    },
    {
      "data_directive": "db",
      "declared_payload_bytes": 2,
      "directive_value_count": 2,
      "directive_width_bytes": 1,
      "fragment_file_offset": 477165,
      "fragment_label": ".at_no_space",
      "fragment_source_line": 6196,
      "is_end_of_table": false,
      "next_fragment_file_offset": 477167,
      "pointer_entry_file_offset": 476955,
      "pointer_expression": "DictionaryEntries_at_no_space",
      "pointer_index": 12,
      "source_extent_bytes": 2,
      "source_extent_matches_directive": true,
      "source_revision": "347c23f9fc019c72d32da537c9cb235f468d021d"
    },
    {
      "data_directive": "db",
      "declared_payload_bytes": 3,
      "directive_value_count": 3,
      "directive_width_bytes": 1,
      "fragment_file_offset": 477167,
      "fragment_label": ".ble",
      "fragment_source_line": 6200,
      "is_end_of_table": false,
      "next_fragment_file_offset": 477170,
      "pointer_entry_file_offset": 476957,
      "pointer_expression": "DictionaryEntries_ble",
      "pointer_index": 13,
      "source_extent_bytes": 3,
      "source_extent_matches_directive": true,
      "source_revision": "347c23f9fc019c72d32da537c9cb235f468d021d"
    },
    {
      "data_directive": "db",
      "declared_payload_bytes": 2,
      "directive_value_count": 2,
      "directive_width_bytes": 1,
      "fragment_file_offset": 477170,
      "fragment_label": ".ba",
      "fragment_source_line": 6204,
      "is_end_of_table": false,
      "next_fragment_file_offset": 477172,
      "pointer_entry_file_offset": 476959,
      "pointer_expression": "DictionaryEntries_ba",
      "pointer_index": 14,
      "source_extent_bytes": 2,
      "source_extent_matches_directive": true,
      "source_revision": "347c23f9fc019c72d32da537c9cb235f468d021d"
    },
    {
      "data_directive": "db",
      "declared_payload_bytes": 2,
      "directive_value_count": 2,
      "directive_width_bytes": 1,
      "fragment_file_offset": 477172,
      "fragment_label": ".be",
      "fragment_source_line": 6208,
      "is_end_of_table": false,
      "next_fragment_file_offset": 477174,
      "pointer_entry_file_offset": 476961,
      "pointer_expression": "DictionaryEntries_be",
      "pointer_index": 15,
      "source_extent_bytes": 2,
      "source_extent_matches_directive": true,
      "source_revision": "347c23f9fc019c72d32da537c9cb235f468d021d"
    },
    {
      "data_directive": "db",
      "declared_payload_bytes": 2,
      "directive_value_count": 2,
      "directive_width_bytes": 1,